analysis_area,test_used,comparison,p_value,effect_size_metric,effect_size,result,business_interpretation,p_value_formatted,effect_size_interpretation
Room type pricing,Kruskal-Wallis,Price by room type,0.0,Epsilon squared,0.284,Significant,Room type is strongly associated with listing price. Entire home/apartment listings have much higher median prices than private rooms and shared rooms.,p < 0.001,Large
Host portfolio pricing,Kruskal-Wallis,Price by host portfolio segment,3.190034004685825e-148,Epsilon squared,0.1071,Significant,"Host portfolio segment is meaningfully related to listing price. Single-listing hosts have the highest median price, while large portfolio hosts have the lowest median price.",p < 0.001,Moderate
Room type occupancy proxy,Kruskal-Wallis,Occupancy proxy by room type,4.548109153865267e-225,Epsilon squared,0.0991,Significant,Occupancy proxy differs across room types. Entire home/apartment listings show much higher unavailable-day ratios than other room types.,p < 0.001,Moderate
Room type review scores,Kruskal-Wallis,Review score rating by room type,1.785602420297705e-122,Epsilon squared,0.0603,Significant,"Review scores differ across room types, but scores are highly concentrated near the top of the rating scale. Entire home/apartment listings have the highest median review score.",p < 0.001,Moderate
Price correlation drivers,Spearman correlation,Price vs selected numeric features,,Spearman correlation,,Mixed feature-level relationships,"Capacity features such as accommodates, bedrooms, and beds show the strongest positive relationships with price. Review activity features show moderate negative relationships with price.",Feature-level results,Not applicable
